"","AuthorID","PaperNO","QuestAuthor","Coauthor","Paper","Journal"
"1","1","1","D Johnson","","Communicating Processes,","J Algorithms"
"2","1","2","D Johnson","","Computing in the Math Department, Part I,","J Algorithms"
"3","1","3","D Johnson","","Computing with One Hand Tied behind Your Back,","J Algorithms"
"4","1","4","D Johnson","","Concurrent Processing,","J Algorithms"
"5","1","5","D Johnson","","A Catalog of Complexity Classes ","Handbook of Theoretical Computer Science Volume A Algorithms and Complexity A"
"6","1","6","D Johnson","","Data Structures for Traveling Salesmen Abstract ","SWAT Scandinavian Workshop Algorithm Theory"
"7","1","7","D Johnson","","Fun and Games,","J Algorithms"
"8","1","8","D Johnson","","Fast Algorithms for Bin Packing ","J Comput Syst Sci"
"9","1","9","D Johnson","","Fast Allocation Algorithms","FOCS IEEE Symposium Foundations of Computer Science"
"10","1","10","D Johnson","","Graph Restrictions and Their Effect,","J Algorithms"
"11","1","11","D Johnson","","Knapsacks, Linear Programs, and a Gamut of Problems,","J Algorithms"
"12","1","12","D Johnson","","Local Optimization and the Traveling Salesman Problem ","ICALP Automata Languages and Programming"
"13","1","13","D Johnson","","Embedding Problems,","J Algorithms"
"14","1","14","D Johnson","","Uniqueness,","J Algorithms"
"15","1","15","D Johnson","","Announcements, Updates, and Greatest Hits,","J Algorithms"
"16","1","16","D Johnson","","Network Design,","J Algorithms"
"17","1","17","D Johnson","","Interactive Proof Systems for Fun and Profit,","J Algorithms"
"18","1","18","D Johnson","","Updates, Updates, Updates,","J Algorithms"
"19","1","19","D Johnson","","Approximation Algorithms for Combinatorial Problems","STOC ACM Symposium Theory of Computing"
"20","1","20","D Johnson","","Approximation Algorithms for Combinatorial Problems ","J Comput Syst Sci"
"21","1","21","D Johnson","","Parallel Processing,","J Algorithms"
"22","1","22","D Johnson","","Partitioning, Covering, and Packing Problems,","J Algorithms"
"23","1","23","D Johnson","","Oracles, Bin Packing, and and Ordering Problems,","J Algorithms"
"24","1","24","D Johnson","","Randomized Algorithms and Complexity Classes,","J Algorithms"
"25","1","25","D Johnson","","Routing Problems,","J Algorithms"
"26","1","26","D Johnson","","Solving NP-Hard Problems Quickly On Average ,","J Algorithms"
"27","1","27","D Johnson","","The Many Faces of Polynomial Time,","J Algorithms"
"28","1","28","D Johnson","","The NP-Completeness Column: An Ongoing Guide ","J Algorithms"
"29","1","29","D Johnson","","The Story So Far,","J Algorithms"
"30","1","30","D Johnson","","The Tale of the Second Prover,","J Algorithms"
"31","1","31","D Johnson","","The Twelve Open Problems From [G&J]","Updates J Algorithms"
"32","1","32","D Johnson","","The Traveling Salesman Problem: A report on the State of the Art ","IFIP International Federation for Information Processing Congress"
"33","1","33","D Johnson","D Applegate; L Buriol; B Dillard; P Shor","The Cutting-Stock Approach to Bin Packing: Theory and Experiments,","Procedings of the Fifth Workshop Algorithm Engineering and Experimentation R E Ladner Editor SIAM Society for Industrial and Applied Mathematics"
"34","1","34","D Johnson","D Aragon; L McGeoch; C Schevon","Optimization by Simulated Annealing: An Experimental Evaluation; Part II, Graph Coloring and Number Partitioning,","Operations Research"
"35","1","35","D Johnson","D Assmann; D Kleitman; J Leung","On a Dual Version of the One-Dimensional Bin Packing Problem,","J Algorithms"
"36","1","36","D Johnson","D Barvinok; A Tamir; G Woeginger; R Woodroofe; S Fekete","The geometric maximum traveling salesman problem ","J ACM"
"37","1","37","D Johnson","D Barvinok; G Woeginger; R Woodroofe","The Maximum Traveling Salesman Problem Under Polyhedral Norms ","IPCO Integer Programming Combinatorial Optimization"
"38","1","38","D Johnson","D Bentley; F Leighton; C McGeoch","An Experimental Study of Bin Packing,","Proc st Ann Allerton Conf Communication Control and Computing"
"39","1","39","D Johnson","D Bentley; F Leighton; C McGeoch; L McGeoch","Some Unexpected Behavior Results for Bin-Packing,","Proc th Ann ACM Symp Theory of Computing"
"40","1","40","D Johnson","D Berman; F Leighton; L Snyder; P Shor","Generalized Planar Matching ","J Algorithms"
"41","1","41","D Johnson","D Berman","Performance of the Efficient Data-Driven Evaluation Scheme ","J Parallel Distrib Comput"
"42","1","42","D Johnson","D Boyce; M Garey","A Note on Bisecting Minimum Spanning Trees,","Networks"
"43","1","43","D Johnson","D Brucker; M Garey","Scheduling Equal-Length Tasks Under Treelike Precedence Constraints to Minimize Maximum Lateness,","Math of Oper Research"
"44","1","44","D Johnson","D Chung; M Garey","On Packing Two-Dimensional Bins,","SIAM Society for Industrial and Applied Mathematics J Algebraic and Discrete Methods"
"45","1","45","D Johnson","D Chvatal; M Garey","Two Results Concerning Multicoloring,","Ann Disc Math"
"46","1","46","D Johnson","D Cirasella; L McGeoch; W Zhang","The Asymmetric Traveling Salesman Problem: Algorithms, Instance Generators, and Tests ","ALENEX Algorithm Engineering and Experiments"
"47","1","47","D Johnson","D Coffman; D Coffman; M Garey","Bin Packing with Divisible Item Sizes,","J Complexity"
"48","1","48","D Johnson","D Coffman; D Coffman; L McGeoch; P Shor; R Weber","Bin Packing with Discrete Item Sizes, Part III: Average Case Behavior of FFD and BFD,",""
"49","1","49","D Johnson","D Coffman; D Coffman; C Courcoubetis; M Garey; P Shor; R Weber;; M Yannakakis","Bin Packing with Discrete Item Sizes, Part I: Perfect Packing Theorems and the Average Case Behavior of Optimal Packings,","SIAM Society for Industrial and Applied Mathematics J Discrete Math"
"50","1","50","D Johnson","D Coffman; P Shor; R Weber","Bin packing with discrete item sizes, part II: Tight bounds on First Fit ","Random Structures and Algorithms"
"51","1","51","D Johnson","D Coffman; M Garey","Dynamic Bin Packing,","SIAM Society for Industrial and Applied Mathematics J Computing"
"52","1","52","D Johnson","D Coffman; D Coffman; C Courcoubetis; M Garey; L McGeoch; P Shor; R Weber; M Yannakakis","Fundamental Discrepancies between Average-Case Analyses under Discrete and Continuous Distributions: A Bin Packing Case Study,","Proc rd Ann ACM Symp Theory of Computing Journal versions See below"
"53","1","53","D Johnson","D Coffman; D Coffman; F Leighton; P Shor; R Weber","Average Case Behavior of FFD and Optimal Bin Packings on U[ ,a] Distributions,",""
"54","1","54","D Johnson","D Coffman; D Coffman; P Shor; R Weber","Markov Chains, Computer Proofs, and Average-Case Analysis of Best Fit Bin Packing,","Proc th Ann ACM Symp Theory of Computing"
"55","1","55","D Johnson","D Coffman; M Garey","An Application of Bin-Packing to Multiprocessor Scheduling ","SIAM Society for Industrial and Applied Mathematics J Comput"
"56","1","56","D Johnson","D Coffman; M Garey","Approximation Algorithms for Bin-Packing - An Updated Survey,","Algorithm Design for Computer System Design G Ausiello M Lucertini and P Serafini editors Springer Verlag"
"57","1","57","D Johnson","D Coffman; D Coffman; M Garey;","Approximation Algorithms for Bin Packing: A Survey,","Approximation Algorithms for NP Hard Problems D Hochbaum editor PWS Publishing"
"58","1","58","D Johnson","D Coffman; D Coffman; G Lueker; P Shor","Probabilistic Analysis of Packing and Related Partitioning Problems,","Statistical Science"
"59","1","59","D Johnson","D Coffman; D Coffman; C Courcoubetis; M Garey; P Shor; R Weber;; M Yannakakis","Perfect Packing Theorems and the Average Case Behavior of Optimal and Online Bin Packing,","SIAM Society for Industrial and Applied Mathematics Review Updated version of above"
"60","1","60","D Johnson","D Coffman; M Garey; R Tarjan","Performance Bounds for Level-Oriented Two-Dimensional Packing Algorithms ","SIAM Society for Industrial and Applied Mathematics J Comput"
"61","1","61","D Johnson","D Coffman; D Coffman; M Garey; A LaPaugh","Scheduling File Transfers,","SIAM Society for Industrial and Applied Mathematics J Comput"
"62","1","62","D Johnson","D Colbourn","Unit Disk Graphs,","Discrete Math"
"63","1","63","D Johnson","D Courcoubetis; E Coffman; M Garey; M Yannakakis; P Shor; R Weber","Bin Packing with Discrete Item Sizes, Part I: Perfect Packing Theorems and the Average Case Behavior of Optimal Packings ","SIAM Society for Industrial and Applied Mathematics J Discrete Math"
"64","1","64","D Johnson","D Courcoubetis; E Coffman; L McGeoch; M Garey; M Yannakakis; P Shor; R Weber","Fundamental Discrepancies between Average-Case Analyses under Discrete and Continuous Distributions: A Bin Packing Case Study","STOC ACM Symposium Theory of Computing"
"65","1","65","D Johnson","D Csirik","Bounded Space On-Line Bin Packing: Best is Better than First,","Algorithmica Preliminary version appeared Proc Ann ACM SIAM Society for Industrial and Applied Mathematics Symp Discrete Algorithms"
"66","1","66","D Johnson","D Csirik; D Johnson; D Johnson; C Kenyon","Better Approximation Algorithms for Bin Covering,","Proc th Ann ACM SIAM Society for Industrial and Applied Mathematics Symp Discrete Algorithms"
"67","1","67","D Johnson","D Csirik; C Kenyon; J Orlin; P Shor; R Weber","On the Sum-of-Squares Algorithm for Bin Packing,","Proc Annual ACM Symp Theory of Computing Journal version to J ACM"
"68","1","68","D Johnson","D Csirik; C Kenyon; P Shor; R Weber","A Self-Organizing Bin Packing Heuristic,","Algorithm Engineering and Experimentation M T Goodrich and C C McGeoch Eds Springer Lecture Notes Computer Science"
"69","1","69","D Johnson","D Dahlhaus; C Papadimitriou; P Seymour; M Yannakakis","The Complexity of Multiterminal Cuts,","SIAM Society for Industrial and Applied Mathematics J Computing"
"70","1","70","D Johnson","D Day; D Sankoff","The Computational Complexity of Inferring Rooted Phylogenies by Parsimony,","Math Biosciences"
"71","1","71","D Johnson","D Demers; J Ullman; M Garey; R Graham","Worst-Case Performance Bounds for Simple One-Dimensional Packing Algorithms ","SIAM Society for Industrial and Applied Mathematics J Comput"
"72","1","72","D Johnson","D Fraenkel; M Garey; T Schaefer; Y Yesha","The Complexity of Checkers on an NxN Board: Preliminary Report,","Proc th Annual Symposium Foundations of Computer Science"
"73","1","73","D Johnson","D Fraenkel; M Garey; T Schaefer; Y Yesha","The Complexity of Checkers on an N * N Board - Preliminary Report","FOCS IEEE Symposium Foundations of Computer Science"
"74","1","74","D Johnson","D Fredman; L McGeoch; G Ostheimer","Data Structures for Traveling Salesmen,","J Algorithms"
"75","1","75","D Johnson","D Garey; R Graham; D Knuth","Complexity Results for Bandwidth Minimization,","SIAM Society for Industrial and Applied Mathematics J Appl Math"
"76","1","76","D Johnson","D Garey","Complexity Results for Multiprocessor Scheduling Under Resource Constraints,","SIAM Society for Industrial and Applied Mathematics J Computing"
"77","1","77","D Johnson","D Garey","Composing Functions to Minimize Image Size ","SIAM Society for Industrial and Applied Mathematics J Comput"
"78","1","78","D Johnson","D Garey; W Freeman","Computers and Intractability: A Guide to the Theory of NP-Completeness",""
"79","1","79","D Johnson","D Garey","Crossing Number is NP-Complete,","SIAM Society for Industrial and Applied Mathematics J Algebraic and Discrete Methods"
"80","1","80","D Johnson","D Garey; F Hwang","Algorithms for a Set Partitioning Problem Arising in the Design of Multi-Purpose Units,","IEEE Trans Computers C"
"81","1","81","D Johnson","D Garey; R Graham","On a Number Theoretic Bin Packing Conjecture,","Proc th Hungarian Combinatorics Colloquium"
"82","1","82","D Johnson","D Garey; H So","An Application of Graph Coloring To Printed Circuit Testing,","IEEE Trans Circuits and Systems CAS"
"83","1","83","D Johnson","D Garey","A Note on A Note on 'Some Simplified NP-Complete Graph Problems' ,","SIGACT News page"
"84","1","84","D Johnson","D Garey","Approximation Algorithms For Bin Packing Problems: A Survey,","Analysis and Design of Algorithms Combinatorial Optimization G Ausiello and M Lucertini editors Springer Verlag"
"85","1","85","D Johnson","D Garey","Approximation Algorithms for Combinatorial Problems: An Annotated Bibliography,","Algorithms and Complexity New Directions and Recent Results J F Traub editor Academic Press"
"86","1","86","D Johnson","D Garey; R Graham","Performance Guarantees for Scheduling Algorithms,","Operations Research"
"87","1","87","D Johnson","D Garey; R Graham; A Yao","Resource Constrained Scheduling as Generalized Bin Packing,","J Comb Theory A"
"88","1","88","D Johnson","D Garey; B Simons; R Tarjan","Scheduling Unit-Time Tasks with Arbitrary Release Times and Deadlines,","SIAM Society for Industrial and Applied Mathematics J Computing"
"89","1","89","D Johnson","D Garey; R Tarjan; M Yannakakis","Scheduling Opposing Forests,","SIAM Society for Industrial and Applied Mathematics J Algebraic and Discrete Methods"
"90","1","90","D Johnson","D Garey","Scheduling Tasks with Nonuniform Deadlines on Two Processors ","J ACM"
"91","1","91","D Johnson","D Garey; R Graham","Some NP-Complete Geometric Problems,","Proc th Annual ACM Symp Theory of Computing"
"92","1","92","D Johnson","D Garey; L Stockmeyer","Some Simplified NP-Complete Graph Problems,","Theoretical Comp Sci"
"93","1","93","D Johnson","D Garey","``Strong'' NP-Completeness Results: Motivation, Examples, and Implications ","J ACM"
"94","1","94","D Johnson","D Garey; G Miller; C Papadimitriou","The Complexity of Coloring Circular Arcs and Chords,","SIAM Society for Industrial and Applied Mathematics J Algebraic and Discrete Methods"
"95","1","95","D Johnson","D Garey; R Graham","The Complexity of Computing Steiner Minimal Trees,","SIAM Society for Industrial and Applied Mathematics J Appl Math"
"96","1","96","D Johnson","D Garey; R Sethi","The Complexity of Flowshop and Jobshop Scheduling,","Math of Oper Research"
"97","1","97","D Johnson","D Garey","The Complexity of Near-Optimal Graph Coloring ","J ACM"
"98","1","98","D Johnson","D Garey; H Witsenhausen","The Complexity of the Generalized Lloyd-Max Problem,","IEEE Trans Information Theory IT"
"99","1","99","D Johnson","D Garey; R Tarjan","The Planar Hamiltonian Circuit Problem is NP-Complete ","SIAM Society for Industrial and Applied Mathematics J Comput"
"100","1","100","D Johnson","D Garey","The Rectilinear Steiner Tree Problem in NP Complete ","SIAM Society for Industrial and Applied Mathematics Journal of Applied Mathematics"
"101","1","101","D Johnson","D Garey","The Rectilinear Steiner Tree Problem is NP-Complete,","SIAM Society for Industrial and Applied Mathematics J Appl Math"
"102","1","102","D Johnson","D Garey","A / Theorem for Bin Packing,","J Complexity"
"103","1","103","D Johnson","D Garey","Two-Processor Scheduling with Start-Times and Deadlines,","SIAM Society for Industrial and Applied Mathematics J Computing"
"104","1","104","D Johnson","D Garey; F Preparata; R Tarjan","Triangulating a Simple Polygon,","Information Processing Letters"
"105","1","105","D Johnson","D Goldwasser; D Johnson; D Johnson; C Editors","Proceedings of the th and th DIMACS Implementation Challenges,","American Mathematical Society"
"106","1","106","D Johnson","D Haas; J Winters; J Winters","Simulation Results of the Capacity of Cellular Systems,","IEEE Trans Vehicular Technology"
"107","1","107","D Johnson","D Hwang; M Garey","Algorithms for a Set Partitioning Problem Arising in the Design of Multipurpose Units ","IEEE Trans Computers"
"108","1","108","D Johnson","D Csirik","Bounded Space On-Line Bin Packing: Best is Better than First ","SODA Symposium Discrete Algorithms"
"109","1","109","D Johnson","D Csirik","Bounded Space On-Line Bin Packing: Best Is Better than First ","Algorithmica"
"110","1","110","D Johnson","D Editor; M Maintainer"," th DIMACS Implementation Challenge: The Traveling Salesman Problem,"," http www research att com dsj chtsp index html"
"111","1","111","D Johnson","D Editor","Challenges for Theoretical Computer Science: DRAFT June ,"," http www research att com dsj nsflist html"
"112","1","112","D Johnson","D Editor","STOC/FOCS Bibliography,","ACM Press"
"113","1","113","D Johnson","M Editors","Cliques, Coloring, and Satisfiability: Proceedings of the nd DIMACS Implementation Challenge,","American Mathematical Society"
"114","1","114","D Johnson","C Papadimitriou","Computational Complexity,","The Traveling Salesman Problem E L Lawler J K Lenstra A H G Rinnooy Kan and D B Shmoys editors John Wiley and Sons Ltd"
"115","1","115","D Johnson","","A Catalogue of Complexity Classes,","The Handbook of Theor Comp Sci J Van Leeuwen editor Elsevier"
"116","1","116","D Johnson","T Nishizeki; A Nozaki; H Editors","Discrete Algorithms and Complexity: Proceedings of the Japan-US Joint Seminar, June - , , Kyoto, Japan,","Academic Press New"
"117","1","117","D Johnson","","Fast Algorithms for Bin Packing,","Journal of Computer and System Sciences"
"118","1","118","D Johnson","C Papadimitriou; M Yannakakis","How Easy is Local Search?,","Journal of Computer and System Sciences Preliminary version Proc th Ann IEEE Symp Foundations of Computer Science"
"119","1","119","D Johnson","H Pollack","Hypergraph Planarity and the Complexity of Drawing Venn Diagrams,","J Graph Theory"
"120","1","120","D Johnson","","Local Optimization and the Traveling Salesman Problem,","Proc th Colloq Automata Lang and Prog"
"121","1","121","D Johnson","A LaPaugh; R Pinter","Minimizing Channel Density by Lateral Shifting of Components,","Proc th Ann ACM SIAM Society for Industrial and Applied Mathematics Symp Discrete Algorithms"
"122","1","122","D Johnson","L McGeoch","Experimental Analysis of Heuristics for the STSP,","The Traveling Salesman Problem and its Variations G Gutin and A Punnen Editors Kluwer Academic Publishers Dordrecht"
"123","1","123","D Johnson","G Gutin; L McGeoch; A Yeo; W Zhang;; A Zverovich","Experimental Analysis of Heuristics for the ATSP,","The Traveling Salesman Problem and its Variations G Gutin and A Punnen Editors Kluwer Academic Publishers Dordrecht"
"124","1","124","D Johnson","","More Approaches to the Travelling Salesman Guide,","Nature page"
"125","1","125","D Johnson","C Papadimitriou; M Yannakakis","On Generating all Maximal Independent Sets,","Information Processing Letters"
"126","1","126","D Johnson","M Szegedy","What are the Least Tractable Instances of Max Independent Set?,","Proc th Ann ACM SIAM Society for Industrial and Applied Mathematics Symp Discrete Algorithms S S"
"127","1","127","D Johnson","K Niemi","On Knapsacks, Partitions, and a New Dynamic Programming Technique for Trees,","Math of Oper Research"
"128","1","128","D Johnson","","NP-Completeness: An Ongoing Guide,","Academic Press Collection of NP completeness columns"
"129","1","129","D Johnson","","On Property $B_r$,","J Comb Theory B"
"130","1","130","D Johnson","J Bentley; L McGeoch;; E Rothberg","Near-Opimal Solutions to Very Large Traveling Salesman Problems,"," Monograph preparation"
"131","1","131","D Johnson","","Worst Case Behavior of Graph Coloring Algorithms,","Proc th Southeastern Conf Comb Graph Theory and Computing"
"132","1","132","D Johnson","M Garey; R Graham; A Demers; J Ullman","Worst Case Performance Bounds for Simple One-Dimensional Packing Algorithms,","SIAM Society for Industrial and Applied Mathematics J Computing"
"133","1","133","D Johnson","C Editors","Network Flows and Matching: Proceedings of the st DIMACS Implementation Challenge,","American Mathematical Society"
"134","1","134","D Johnson","","Approximation Algorithms for Combinatorial Problems,","Journal of Computer and System Sciences"
"135","1","135","D Johnson","C Papadimitriou","Performance Guarantees for Heuristics,","The Traveling Salesman Problem E L Lawler J K Lenstra A H G Rinnooy Kan and D B Shmoys editors John Wiley and Sons Ltd"
"136","1","136","D Johnson","A Klug","Optimizing Conjunctive Queries that Contain Untyped Variables,","SIAM Society for Industrial and Applied Mathematics J Computing"
"137","1","137","D Johnson","C Aragon; L McGeoch; C Shevon","Optimization by Simulated Annealing: An Experimental Evaluation; Part I, Graph Partitioning,","Operations Research"
"138","1","138","D Johnson","","Slow Ant,","New Scientist page"
"139","1","139","D Johnson","L McGeoch;; E Rothberg","Asymptotic Experimental Analysis for the Held-Karp Traveling Salesman Bound,","Proc th Ann ACM SIAM Society for Industrial and Applied Mathematics Symp Discrete Algorithms"
"140","1","140","D Johnson","J Lenstra; A Kan","The Complexity of the Network Design Problem,","Networks"
"141","1","141","D Johnson","F Preparata","The Densest Hemisphere Problem,","Theoretical Comp Sci"
"142","1","142","D Johnson","","The Genealogy of Theoretical Computer Science,","SIGACT News"
"143","1","143","D Johnson","M Minkoff;; S Phillips","The Prize Collecting Steiner Tree Problem: Theory and Practice,","Proc th Ann ACM SIAM Society for Industrial and Applied Mathematics Symp Discrete Algorithms"
"144","1","144","D Johnson","L McGeoch","The Traveling Salesman Problem: A Case Study in Local Optimization,","Local Search Combinatorial Optimization E H L Aarts and J K Lenstra editors John Wiley and Sons Ltd"
"145","1","145","D Johnson","A Klug","Testing Containment of Conjunctive Queries under Functional and Inclusion Dependencies,","Journal of Computer and Systems Sciences"
"146","1","146","D Johnson","","A Theoretician's Guide to the Experimental Analysis of Algorithms,"," Proceedings of the th and th DIMACS Implementation Challenges M Goldwasser D S Johnson and C C McGeoch Editors American Mathematical Society"
"147","1","147","D Johnson","D Kenyon; J Csirik","Better approximation algorithms for bin covering ","SODA Symposium Discrete Algorithms"
"148","1","148","D Johnson","D Kenyon; J Csirik; J Orlin; P Shor; R Weber","On the sum-of-squares algorithm for bin packing ","STOC ACM Symposium Theory of Computing"
"149","1","149","D Johnson","D Kenyon; J Csirik; P Shor; R Weber","A Self Organizing Bin Packing Heuristic ","ALENEX Algorithm Engineering and Experiments"
"150","1","150","D Johnson","D Kleitman; J Leung; S Assmann","On a Dual Version of the One-Dimensional Bin Packing Problem ","J Algorithms"
"151","1","151","D Johnson","D Klug","Optimizing Conjunctive Queries When Attribute Domains Are not Disjoint Extended Abstract ","FOCS IEEE Symposium Foundations of Computer Science"
"152","1","152","D Johnson","D Klug","Optimizing Conjunctive Queries that Contain Untyped Variables ","SIAM Society for Industrial and Applied Mathematics J Comput"
"153","1","153","D Johnson","D Klug","Testing Containment of Conjunctive Queries Under Functional and Inclusion Dependencies ","PODS Symposium Principles of Database Systems"
"154","1","154","D Johnson","D Klug","Testing Containment of Conjunctive Queries under Functional and Inclusion Dependencies ","J Comput Syst Sci"
"155","1","155","D Johnson","D LaPaugh; R Pinter","Minimizing Channel Density by Lateral Shifting of Components ","SODA Symposium Discrete Algorithms"
"156","1","156","D Johnson","D LaPaugh; E Coffman; M Garey","Scheduling File Transfers ","SIAM Society for Industrial and Applied Mathematics J Comput"
"157","1","157","D Johnson","D LaPaugh; E Coffman; M Garey","Scheduling File Transfers in a Distributed Network ","PODC Symposium Principles of Distributed Computing"
"158","1","158","D Johnson","Z Mao; O Spatscheck; J Merwe;; J Wang","Efficient and robust streaming provisioning in VPNs,","Proceedings WWW World Wide Web Conference Series"
"159","1","159","D Johnson","Z Mao; J Rexford; J Wang;; R Katz","Scalable and accurate identification of AS-level forwarding paths,"," Proceedings INFOCOM The Conference Computer Communications"
"160","1","160","D Johnson","D McGeoch; F Leighton; J Bentley; L McGeoch","Some Unexpected Expected Behavior Results for Bin Packing","STOC ACM Symposium Theory of Computing"
"161","1","161","D Johnson","D Megiddo; S Hakimi; M Garey; C Papadimitriou","The Complexity of Searching a Graph,","J Assoc Comp Mach"
"162","1","162","D Johnson","D Merwe; J Wang; O Spatscheck; Z Mao","Efficient and robust streaming provisioning in VPNs ","WWW World Wide Web Conference Series"
"163","1","163","D Johnson","D Minkoff; S Phillips","The prize collecting Steiner tree problem: theory and practice ","SODA Symposium Discrete Algorithms"
"164","1","164","D Johnson","D Ostheimer; L McGeoch; M Fredman","Data Structures for Traveling Salesmen ","SODA Symposium Discrete Algorithms"
"165","1","165","D Johnson","D Ostheimer; L McGeoch; M Fredman","Data Structures for Traveling Salesmen ","J Algorithms"
"166","1","166","D Johnson","D Papadimitriou; M Yannakakis","How Easy is Local Search?","J Comput Syst Sci"
"167","1","167","D Johnson","D Papadimitriou; M Yannakakis","How Easy Is Local Search? Extended Abstract ","FOCS IEEE Symposium Foundations of Computer Science"
"168","1","168","D Johnson","D Papadimitriou","On Generating All Maximal Independent Sets ","Inf Process Lett"
"169","1","169","D Johnson","D Papadimitriou; E Dahlhaus; M Yannakakis; P Seymour","The Complexity of Multiway Cuts Extended Abstract ","STOC ACM Symposium Theory of Computing"
"170","1","170","D Johnson","D Papadimitriou; E Dahlhaus; M Yannakakis; P Seymour","The Complexity of Multiterminal Cuts ","SIAM Society for Industrial and Applied Mathematics J Comput"
"171","1","171","D Johnson","D Papadimitriou; M Garey; N Megiddo; S Hakimi","The complexity of searching a graph ","J ACM"
"172","1","172","D Johnson","D Papadimitriou; M Garey; N Megiddo; S Hakimi","The Complexity of Searching a Graph Preliminary Version ","FOCS IEEE Symposium Foundations of Computer Science"
"173","1","173","D Johnson","D Preparata","The Densest Hemisphere Problem ","Theor Comput Sci"
