"","AuthorID","PaperNO","QuestAuthor","Coauthor","Paper","Journal"
"359","11","2","D Johnson","D Lilja; J Riedl","A Circulating Active Barrier Synchronization Mechanism ","ICPP International Conference Parallel Processing"
"360","11","3","D Johnson","D Lilja; J Anderson; J Riedl","Low-Cost, High-Performance Barrier Synchronization on Networks of Workstations ","J Parallel Distrib Comput"
"361","12","1","D Johnson","D Brown","Formal Security Proofs for a Signature Scheme with Partial Message Recovery ","RSA"
"362","12","2","D Johnson","","AES and Future Resiliency: More Thoughts and Questions ","AES Candidate Conference"
"363","13","1","D Johnson","B Kingsbury; J Beck; J Wawrzynek; K Asanovic; N Morgan","SPERT-II: A Vector Microprocessor System and its Application to Large Problems in Backpropagation Training ","NIPS Neural Information Processing Systems"
"364","13","2","D Johnson","B Kingsbury; J Beck; J Wawrzynek; K Asanovic; N Morgan","Spert-II: A Vector Microprocessor System ","IEEE Computer"
"365","14","1","D Johnson","","Trap Architectures for Lisp Systems ","LISP and Functional Programming"
"366","14","2","D Johnson","","The Case for a Read Barrier ","ASPLOS Architectural Support for Programming Languages and Operating Systems"
"367","15","1","D Johnson","C Berman; J Coplien; J Daniels; K Rubin; L Hill","Managing Object Oriented Projects - Panel Session ","OOPSLA Conference Object Oriented Programming Systems Languages and Applications"
"368","15","2","D Johnson","C Berman; J Coplien; J Daniels; K Rubin; L Hill","Object-oriented project management panel ","OOPS Messenger"
