"","AuthorID","PaperNO","QuestAuthor","Coauthor","Paper","Journal"
"186","2","42","M Miller","","Representing The Variation of Thermodynamic State Via Principal Components Analysis,","Proc Third Workshop Conventional Weapon ATR U S Army Missile Command"
"187","2","43","M Miller","M Morris","Hippocampal Volume and shape Variation Predicts Cognitive Decline in Nondemented Elder Subjects,","World Congress"
"188","2","44","M Miller","","Abnormalities of Thalamic Volume and Shape in Schizophrenia,","American Journal of Psychiatry"
"189","2","45","M Miller","","A Comparison of the Hippocampus in Schizophrenia and Control Subjects using Automated Methods for Neuromorphometry,","Schizophrenia Research"
"190","2","46","M Miller","","A Comparison of the Hippocampus in Schizophrenia and Control Subjects Using Automated Methods for Neuromorphometry ,"," th Annual Meeting of the ACNP San Juan Puerto Rico"
"191","2","47","M Miller","","A Computerized Brain Mapping Method for Detailed Analyses of Neuroanatomical Shapes and Volumes,","International Journal of Psychopharmacology Suppl S"
"192","2","48","M Miller","","Hippocampal Deformities Detected in Schizophrenia and Alzheimer's Disease by High Dimensional Brain Mapping,","European Neuropsychopharmacology Suppl S"
"193","2","49","M Miller","","Hippocampal Deformities in Schizophrenia Characterized by high Dimensional Brain mapping,","The American Journal of Psychiatry"
"194","2","50","M Miller","M Morris","Hippocampal Volume and Shape Predicts Cognitive Decline in the Elderly,","Neuroimage"
"195","2","51","M Miller","M Morris","Hippocampal Volume and Shape Predicts Cognitive Decline in the Elderly,","World Alzheimer Congress Stockholm"
"196","2","52","M Miller","","Hippocampal Morphometry in Dementia of the Alzheimer Type by Computer Algorithm,","Society of Neuroscience Abstracts"
"197","2","53","M Miller","","Hippocampal Morphometry in Schizophrenia by High Dimensional Brain Mapping ,","Proceedings of the National Academy of Science"
"198","2","54","M Miller","","Early DAT is Distinguished from Aging by High Dimensional Mapping of the Hippocampus,","Neurology"
"199","2","55","M Miller","","Early DAT is Distinguished from Aging by High Dimensional Mapping of the Hippocampus,","First International Meeting of Alzheimer s Imaging Consortium DC"
"200","2","56","M Miller","","Variational Problems on Flows of Diffeomorphisms for Image Matching,","Quarterly J Applied Math ed D Mumford and W Freiberger"
"201","2","57","M Miller","M I","Mapping visual cortex in monkeys and humans using surface-based atlases,","Vision Research"
"202","2","58","M Miller","M Grenander","Detection of Multiple Airborne Targets from Multi-Sensor Data,","SPIE The International Society for Optical Engineering Proceedings Volume Radar Ladar Signal Processing and Applications"
"203","2","59","M Miller","","On the Existence of Positive Definite Maximum-Likelihood Estimates of Structured Covariance Matrices,","IEEE Trans Inform Theory"
"204","2","60","M Miller","","On the Singularity of Maximum-Likelihood Estimates of Structured Covariance Matrices,","Proc st Annu Conf Inform Sci and Syst"
"205","2","61","M Miller","","Landmark Matching via Large Deformation Diffeomorphisms on the Sphere,","Journal of Mathematical Imaging and Vision special issue of Mathematics and Image Analysis"
"206","2","62","M Miller","","Computational Anatomy: An Emerging Discipline,","Quarterly of Applied Mathematics LVI"
"207","2","63","M Miller","","Computational Anatomy: An Emerging Discipline,","feature article Statistical Computing and Graphics Newsletter"
"208","2","64","M Miller","M Christensen","Deformable Anatomical Data Bases Using Global Shape Models: a Position Paper for the Electronic Imaging of the Human Body Workshop,","Proceedings of the Cooperative Working Group Whole Body D Electronic Imaging of the Human Body"
"209","2","65","M Miller","M Srivastava","Hilbert-Schmidt Lower Bounds for Estimators on Matrix Lie Groups for ATR,","IEEE Trans Pattern Analysis and Machine Intelligence"
"210","2","66","M Miller","","Representation of Knowledge In Complex Systems with discussion section ,","Journal of the Royal Statitical Society"
"211","2","67","M Miller","U Miller","Asymptotic Performance Analysis of Bayesian Object Recognition,","IEEE Transactions Information Theory pages"
"212","2","68","M Miller","M Vannier","A Comparison of Automated and Manual Segmentation of Hippocampus MR Images,","SPIE The International Society for Optical Engineering Proceedings of the Conference Medical Imaging San Diego"
"213","2","69","M Miller","M Vannier","Functional and structural mapping of human cerebral cortex: Solutions are in the surfaces,","Y Bizais C Braillot and R Di Paola editors Information Processing Medical Imaging th International Conference Kluwer Academic Publishers Precision and Accuracy of a High Dimensional Transformation and Segmentation of MR Images of the Hippocampus"
"214","2","70","M Miller","M Raichle","High Dimensional Transformation of PET and MRI to Atlas Space,"," Intl Conf Functional Mapping of the Human Brain"
"215","2","71","M Miller","M Vannier","Hippocampal MR Imaging Morphometry By Means of General Pattern Matching,","Radiology"
"216","2","72","M Miller","M Vannier","MRI Segmentation Using High Dimensional Transformations of a Digital Atlas,","Poster at American of Neuropsychopharmacology Conference San Juan Puerto Rico"
"217","2","73","M Miller","M Bucholz","MR Imaging Deformation-Based Segmentation of the Hippocampus in Patients with Mesial Temporal Sclerosis and Temporal Lobe Epilepsy,","Epilepsia Suppl page"
"218","2","74","M Miller","M Bucholz","Mesial Temporal Sclerosis and Temporal Lobe Epilepsy: MR Imaging Deformation-based Segmentation of the Hippocampus in Five Patients,","Radiology"
"219","2","75","M Miller","","Automatic Target Recognition Using Sequences of High Resolution Radar Range Profiles,","ESSRL Monograph number ESSRL"
"220","2","76","M Miller","M Jain; K Ramchandran; P Moulin","Information-Theoretic Bounds on Target Recognition Performance Based on Degraded Image Data ","IEEE Transactions Pattern Analysis and Machine Intelligence"
"221","2","77","M Miller","M Ramchandran","Information-Theoretic Bounds on Target Recognition Performance Based on Degraded Image Data,","IEEE Transactions Pattern Analysis and Machine Intelligence pages"
"222","2","78","M Miller","M Ramchandran","Performance Bounds for ATR based on Compressed Data,","Proc th Army Compression Workshop"
"223","2","79","M Miller","","Functional and Structural Mapping of Human Cerebral Cortex: Solutions Are In the Surfaces,","Proceedings of the National Academy of Science"
"224","2","80","M Miller","M Grenander","Hierarchical Brain Mapping via A Generalized Dirichlet Solution for Mapping Brain Manifolds,","Vision Geometry IV Proceedings of the SPIE The International Society for Optical Engineering s International Symposium Optical Science Engineering and Instrumentation San Diego Computer Animation"
"225","2","81","M Miller","","Landmark Matching Via Large Deformation Diffeomorphisms,","IEEE Transactions Image Processing pages"
"226","2","82","M Miller","","Maximum a Posteriori estimation with Good's Roughness for Optical Sectioning Microsopy,","Optical Society of America A"
"227","2","83","M Miller","M Grenander","On the Differential Geometry of the Cortical Surface,","Vision Geometry IV Proceedings of the SPIE The International Society for Optical Engineering s International Symposium Optical Science Engineering and Instrumentation San Diego Computer Animation"
"228","2","84","M Miller","M Grenander","On the Geometry and Shape of Brain Sub-Manifolds,","International Journal of Pattern Recognition and Artificial Intelligence"
"229","2","85","M Miller","","A New Method for Estimating Stimulus and Refractory Related Functions from Auditory-Nerve Discharges,","Basic Issues Hearing ed H Duifhuis et Academic Press"
"230","2","86","M Miller","M Khaneja; U Grenander","Dynamic Programming Generation of Curves on Brain Surfaces ","IEEE Transactions Pattern Analysis and Machine Intelligence"
"231","2","87","M Miller","M Grenander","Dynamic Programming Generation of Geodesics and Sulci on Brain Surfaces,","IEEE Trans Pattern Analysis and Machine Intelligence"
"232","2","88","M Miller","M Green; ; Snyder","Multispectral Active-Passive Sensor Fusion for Ground-Based Target Orientation Estimation,","Proc SPIE The International Society for Optical Engineering Automatic Target Recognition VIII Ed Firooz A Sadjadi"
"233","2","89","M Miller","M Green; ; Snyder","Multispectral Sensor Fusion for Ground-Based Target Orientation Estimation: FLIR, LADAR, HRR,","Proc SPIE The International Society for Optical Engineering Automatic Target Recognition IX Ed Firooz A Sadjadi"
"234","2","90","M Miller","M Lanterman; U Grenander","Bayesian Segmentation via Asymptotic Partition Functions ","IEEE Transactions Pattern Analysis and Machine Intelligence"
"235","2","91","M Miller","","Efficient Estimation of Thermodynamic State Incorporating Bayesian Model Order Selection,","Automatic Target Recognition IX SPIE The International Society for Optical Engineering Proc"
"236","2","92","M Miller","M Snyder","General Metropolis-Hastings Jump Diffusions for Automatic Target Recognition in Infrared Scenes,","J Opt Engineering"
"237","2","93","M Miller","M Miceli","Jump-diffusion Processes for the Automated Understanding of FLIR Scenes,","Automatic Object Recognition IV Proc SPIE The International Society for Optical Engineering Ed Firooz J Sadjadi"
"238","2","94","M Miller","","Kullback-Liebler Distances for Quantifying Clutter and Models,","Optical Engineering"
"239","2","95","M Miller","M Snyder","Implementation of Jump-diffusion Algorithms for Understanding FLIR Scenes,","Automatic Object Recognition V Proc SPIE The International Society for Optical Engineering Ed Firooz A Sadjadi"
"240","2","96","M Miller","","Extension of Good's Roughness for maximum Penalized-Likelihood Estimation for Emission Tomography,","IEEE Trans Medical Imaging"
"241","2","97","M Miller","M Snyder","Representations of Shape for Structural Inference in Infrared Scenes,","Proc SPIE The International Society for Optical Engineering th Annu Intl Sympos Aerosp Defense Sensing Simulation and Contr"
"242","2","98","M Miller","M Snyder","Representations of Thermodynamic Variability in the Automated Understanding of FLIR Scenes,","Automatic Object Recognition Proc SPIE The International Society for Optical Engineering Ed Firooz A Sadjadi"
"243","2","99","M Miller","M Snyder","The Unification of Detection, Tracking, and Recognition for Millimeter Wave and Infrared Sensors,","Radar Ladar Processing Proc SPIE The International Society for Optical Engineering Ed William J Miceli"
"244","2","100","M Miller","M Snyder","Automatic Target Recognition via the Simulation of Infrared Scenes,","Proc of the Sixth Annual Ground Target Modeling and Validation Conference Keweenaw Research Center Tech Univ"
"245","2","101","M Miller","","Estimation of Pose and location of Ground-Targets for ATR,","Proceedings SPIE The International Society for Optical Engineering the International Society fo rOptical Engineering X Issue"
"246","2","102","M Miller","","Bayesian Model Selection and Minimum Description -D Length Estimation of Auditory-Nerve Discharge Rates,","J Acoust Soc Am"
"247","2","103","M Miller","M Grenander","Constrained Stochastic Language Models,","Image Models and their Speech Model Cousins ed S Levinson and L Shepp New Springer Verlag"
"248","2","104","M Miller","M Grenander","Parameter Estimation for Constrained Context Free Language Models,","DARPA Speech and Natural Language Workshop"
"249","2","105","M Miller","M Csernansky","Bayesian construction of geometrically based cortical thickness metrics,","Neuroimage"
"250","2","106","M Miller","M Grenander","Conditional-Mean Estimation via Jump-Diffusion Processes in Multiple Target Tracking/Recognition,","IEEE Transactions Signal Processing"
"251","2","107","M Miller","M Butler"," -D Maximum A-Posteriori Estimation of SPECT on Massively Parallel Computers,","IEEE Trans Med Imag"
"252","2","108","M Miller","M Younes","Group Actions, Homeomorphisms, and Matching: A General Framework,","International Journal of Computer Vision Volume pages"
"253","2","109","M Miller","M Csernansky","Labeled cortical mantle distnace maps quantify differences between dementia of the Alzheimer type and healthy aging,","Proceedings of the National Academy of Sciences pg"
"254","2","110","M Miller","","Algorithms for Removing Recovery Related Distortion from Auditory-Nerve Discharge Patterns,","J Acoust Soc Am"
"255","2","111","M Miller","M Christensen","Large Deformation Fluid Diffeomorphisms For Landmark and Image Matching"," Brain Warping Academic Press San Diego Computer Animation"
"256","2","112","M Miller","M Grenander","Membranes, Mitochondria, and Amoebae: , , and Dimensional Shape Models,","Advances Applied Statistics ed K Mardia England Carfax II"
"257","2","113","M Miller","M Snyder","Maximum-Likelihood Methods for Toeplitz Covariance Estimation and Radar Imaging",""
"258","2","114","M Miller","M Fuhrmann","Maximum-Likelihood Narrow-Band Direction Finding and the EM Algorithm,","IEEE Acoust Speech and Signal Process"
"259","2","115","M Miller","","Maximum-Likelihood Reconstruction for Single-Photon Emission Computed-Tomography,","IEEE Trans Nucl Sci"
"260","2","116","M Miller","M Fuhrmann","Maximum-Likelihood Estimation of Direction of Arrivals of Multiple Narrowband Signals in Noise,","Proc st Annu Conf Inform Sci and Syst"
"261","2","117","M Miller","M Greene","Maximum-Likelihood Estimation for Nuclear Magnetic Resonance Spectroscopy,","J Magn Reson"
"262","2","118","M Miller","M D'Avignon","Maximum-Likelihood Estimation and the EM Algorithm for -D NMR Spectroscopy,","J Magn Reson Series A"
"263","2","119","M Miller","M Thomas","Maximum-Likelihood Estimation Applied to Electron-Microscopic Autoradiography,","J Electron Microscopy Technique"
"264","2","120","M Miller","","Method and apparatus for image registration,","United States Patent US Patent Office"
"265","2","121","M Miller","M Ackerman","A Mathematical Signal Model for Phase and Frequency Encoded Magnetic Resonance Imaging Data,","J Magn Reson series B"
"266","2","122","M Miller","M Grenander","Mathematical Textbook of Deformable Neuroanatomies,","Proceedings of the National Academy of Science"
"267","2","123","M Miller","M Moore","An Evaluation of the Use of Sieves for Producing Estimates of Radioactivity Distributions with the EM Algorithm for Positron Emission Tomography,","IEEE Trans Nucl Sci"
"268","2","124","M Miller","M Snyder","An Alternating Maximization of the Entropy/Likelihood Function for Image Reconstruction and Spectrum Estimation,","Proc SPIE The International Society for Optical Engineering Advanced Architectures and Algorithms"
"269","2","125","M Miller","M Fuhrmann","An EM Algorithm for Direction-of-Arrival Estimation for Narrowband Signals in Noise,","Proc SPIE The International Society for Optical Engineering Advanced Algorithms and Architectures for Signal Process"
"270","2","126","M Miller","M Roysam","A New Method for Analysis of Electron Microscopic Autoradiographs,","Biotechniques"
"271","2","127","M Miller","M Wang","A New Stochastic Model for Auditory-Nerve Discharge,","J Acoust Soc Am"
"272","2","128","M Miller","M Younes","On the Metrics and Euler-Lagrange Equations of Computational Anatomy,","Annual Review of biomedical Engineering"
"273","2","129","M Miller","","Application of Likelihood and Entropy for Toeplitz Constrained Covariance Estimation,","Maximum Entropy and Bayesian Methods Science and Engineering Kluwer Academic Publishers"
"274","2","130","M Miller","M Sachs","Representation of Voice Pitch in Discharge Patterns of Auditory-Nerve Fibers,","Hearing Res"
"275","2","131","M Miller","M Sachs","Representation of Stop Consonants in the Discharge Patterns of Auditory-Nerve Fibers,","J Acoust Soc Am"
"276","2","132","M Miller","","Strategies for the Representation of Broadband Stimuli in the Discharge Patterns of Auditory Nerve Fibers,","Proc NATO Advanced Res Workshop Auditory Frequency Selectivity Auditory Frequency Selectivity"
"277","2","133","M Miller","M Sachs","Strategies for the Representation of a Tone in Background Noise in the Temporal Aspects of the Discharge Patterns of Auditory-Nerve Fibers,","J Acoust Soc Am"
"278","2","134","M Miller","M Matejic","Statistical Methods in Computational Anatomy,","Statistical Methods Medical Research"
"279","2","135","M Miller","M Mark","A Statistical Study of Cochlear Nerve Discharge Patterns in Response to Complex Speech Stimuli,","J Acoust Soc Am"
"280","2","136","M Miller","M Kostakis","The Information Theory of Sensor Fusion,"," ONR GTRI Workshop Target Tracking Sensor Fusion"
"281","2","137","M Miller","M Snyder","The Application of Maximum Entropy and Maximum-Likelihood for Spectral Estimation,","Proc IEEE Intl Inform Theory Sympos IEEE Inform Theory Group p"
"282","2","138","M Miller","M Snyder","The Role of Likelihood and Entropy in Incomplete-Data Problems: Applications to Estimating Point-Process Intensities and Toeplitz Constrained Covariances,","Proc of the IEEE"
"283","2","139","M Miller","M Snyder","Automatic Target Recognition Organized via Jump-Diffusion Algorithms,","IEEE Transactions Image Processing"
"284","2","140","M Miller","M Turmon","Iterative Maximum-Likelihood Estimation of Toeplitz-Constrained Covariances,","Proc th Annu Allerton Conf Commun Contr and Computing"
"285","2","141","M Miller","","Detection Bounds for Automatic Target Recognition in Compressed Domain,","ISIT"
"286","2","142","M Miller","M Snyder","A Likelihood-Based Approach to Joint Target Tracking and Identification,","Conference Record Twenty Seventh Asilomar Conference Signals Systems Computers volume"
"287","2","143","M Miller","J Miller","SAR ATR Performance Using a Conditionally Gaussian Model,","IEEE Transactions Aerospace and Electronic Systems Page"
"288","2","144","M Miller","M Csernansky","High Dimensional Mapping of the Hippocampus in Depression,","The American Journal of Psychiatry"
"289","2","145","M Miller","M Thomas; ; McNally","A Regularized Linear Method for Reconstruction of -D Microscopic Objects from Optical Sections,","J Opt Soc Am A"
"290","2","146","M Miller","M Ratnanather","Segmenting Magnetic Resonance Images via hierarchical Mixture Modellling,","Journal of the American Statistical Association"
"291","2","147","M Miller","","Mapping of Hyperelastic Deformable Templates,","Proceedings of SPIE The International Society for Optical Engineering s Geometric Methods Applied Imaging San Diego Computer Animation"
"292","2","148","M Miller","","Computational Anatomy of the Brain,","National Partnership for Advanced Computational Infrastructure All Hands Meeting San Diego Supercomputer Center"
"293","2","149","M Miller","","Dynamic programming generation of boundaries of local coordinatized submanifolds in the neocortex: application to the Planum Temporale ,","Neuroimage"
"294","2","150","M Miller","","Validating Cortical Surface Analysis of Medial Prefrontal Cortex,","NeuroImage"
"295","2","151","M Miller","","Combining Stochastic and Syntactic Processing with Analog Computation Methods,","Digital Signal Process A Review Journal ed J"
"296","2","152","M Miller","","Grammars and Bayes Priors for Hierarchial Image Processing on Massively Parallel Processors,","Proc Allerton Conf"
"297","2","153","M Miller","","Parallel Algorithms for Maximum A-Posterori Estimation of Spin Density and Spin-Spin Decay in Magnetic Resonance Imaging,","IEEE Trans Med Imag"
"298","2","154","M Miller","","Stochastic Models of the Fast and Slow Components of Synaptic Recovery and Post-Synaptic Action Potential Generation,","Proc Assoc for Res Otolaryngology th Midwinter Meeting p"
"299","2","155","M Miller","","Stochastic Intensity of Hodgkin-Huxley-Based Spike Generation Models,","Proc Assoc for Res Otolaryngology th Midwinter Research Meeting"
"300","2","156","M Miller","","Stochastic Intensity of Neural Spike Discharge Based on Active Channel Dynamics,","Computational Neuroscience Academic Press"
"301","2","157","M Miller","","Stochastic Threshold Characterization of the Intensity of Active Channel Dynamical Action Potential Generation,","The American Physiological Society"
"302","2","158","M Miller","M Rimoldi","Rate-Distortion Theoretic Codebook Design for Automatic Object Recognition,","IEEE Transactions Information Theory pages"
"303","2","159","M Miller","M Smith","Bayesian Inference of Regular Grammar and Markov Source Models ","NIPS Neural Information Processing Systems"
"304","2","160","M Miller","M Schulz","Constrained Probability-Density Estimation from Noisy Data,","Proc Annu Conf Inform Sci and Syst"
"305","2","161","M Miller","","A Case Study in Statistical Image Processing: Positron Emission Tomography, - ","Spatial Statistics and Imaging A Possolo Ed Monograph Series Institute of Mathematical Statistics Computer Animation"
"306","2","162","M Miller","M Thomas; ; Politte","Noise and Edge Artifacts in Maximum-Likelihood Reconstruction for Emission Tomography,","IEEE Trans Med Imag"
"307","2","163","M Miller","","Random Point Processes in Time and Space,"," ed New Springer Verlag"
"308","2","164","M Miller","","Estimation Under Quantum-Limited Conditions,","Topical Meeting Quantum Limited Imaging and Image Process Technical Digest Opt Soc Am"
"309","2","165","M Miller","","The Use of Grenander's Sieves in Quantum-Limited Imaging,","Proc th Annu Allerton Conf Commun Contr and Computing p"
"310","2","166","M Miller","","The Use of Maximum-Likelihood Estimation for Forming Images of Diffuse Radar-Targets from Delay-Doppler Data,","IEEE Trans Inform Theory"
"311","2","167","M Miller","","The Use of Sieves to Stabilize Images Produced with the EM Algorithm for Emission Tomography,","IEEE Trans Nucl Sci"
"312","2","168","M Miller","M Grenander","Bayesian Automated Target Recognition"," Handbook of Video and Image Processing editor Alan Bovik"
"313","2","169","M Miller","M Srivastava; U Grenander","Hilbert-Schmidt Lower Bounds for Estimators on Matrix Lie Groups for ATR ","IEEE Transactions Pattern Analysis and Machine Intelligence"
"314","2","170","M Miller","","Jump-Diffusion Markov Processes on Orthogonal Groups for Object Recognition,","Journal of Statistical Planning and Inference Issues pages"
"315","2","171","M Miller","M Grenander","Jump-Diffusion Processes on Matrix Lie Groups for Bayesian Inference,","IEEE HOS Workshop"
"316","2","172","M Miller","M Grenander","Lie Group Parameterization for Dynamics Based Prior In ATR,","Sixth Digital Signal Processing Workshop"
"317","2","173","M Miller","M Grenander","Multiple Target Direction of Arrival Tracking,","IEEE Transactions Signal Processing"
"318","2","174","M Miller","A Grenander","Multi-Sensor Fusion and Performance Analysis of ATR,","Proc FUSION"
"319","2","175","M Miller","","Monte Carlo Techniques for Automated Target Recognition,","Sequential Monte Carlo Methods Practice eds Arnaud Doucet Nando Freitas Neil Gordon Springer Verlag"
"320","2","176","M Miller","M Grenander","Ergodic Algorithms on Special Euclidean Groups for ATR,","Syst and Contr the st Century Birkha ser"
"321","2","177","M Miller","M Grenander","Ergodic Algorithms on Special Euclidean Groups for ATR,","Proceedings MTNS Publisher Birkhauser"
"322","2","178","M Miller","","Maximum-Likelihood Estimation of Complex Sinusoids and Toeplitz Covariances,","IEEE Trans Signal Process"
"323","2","179","M Miller","","Simulation Results for Maximum-Likehood Estimation of Toeplitz Constrained Covariances,","Proc st Annu Conf Inform Sci and Syst p"
"324","2","180","M Miller","M Grenander","Modeling and Data Structure for Registration to a Brain Atlas of Multidimentional Images,","Functional Neuroimaging ed L Thatcher et New Academic Press"
"325","2","181","M Miller","M Csernansky","Changes in Hippocampal Volume and Shape Across Time Distinguis Dementia of the Alzheimer Type from Healthy Aging,","NeuroImage"
"326","2","182","M Miller","","Construction of Statistical Templates for Cross-Modality Mapping,","Proceedings of the First Aachen Conference Neuropsychology Neurosurgery Psychiatry and Neurology Aachen"
"327","2","183","M Miller","","Validating High-Dimensional Transformations of the Hippocampus,","NeuroImage Proceedings of the Fourth International Conference Functional Mapping of the Human Brain Montreal"
"328","2","184","M Miller","","Large-Deformation Image Matching Via Volume Imagery,","Proceedings of the International Symposium Optical Science Engineering and Instrumentation SPIE The International Society for Optical Engineering s rd Annual Meeting San Diego"
"329","2","185","M Miller","M Csernansky","Progressive Hippocampal Atrophy Distinguishes DAT and Healthy Aging,","Annual Meeting of the Society for Neuroscience"
"330","2","186","M Miller","M Ogielski","A Stochastic Model of Synaptic Transmission and Auditory Nerve Discharge, Part I ,","Computation Neurons and Neural Systems ed F Eckman"
"331","2","187","M Miller","M Ogielski","A Stochastic Model of Synaptic Transmission and Auditory Nerve Discharge, Part II ,","Computation Neurons and Neural Systems ed F Eckman"
"332","2","188","M Miller","M Csernansky","Statistical Analysis of Hippocampal Asymmetry in Schizophrenia,","NeuroImage"
"333","2","189","M Miller","M Csernansky","Statistical Analysis of Hippocampal Asymmetry in Schizophrenia,","Annual Meeting of the Society for Neuroscience New Orleans"
"334","2","190","M Miller","","A Heart Failure Knowledgebase Combining Experimental Data with Tools for Integrative Biological Modeling,","The Novartis Foundation Symposium Silico Simulation of Biological Processes University London"
